{
  "$schema": "group-codec-v1.vectors.schema.json",
  "schemaVersion": "1.0.0",
  "status": "FROZEN_TARGET_NOT_ACTIVE",
  "records": [
    {
      "id": "giv1-canonical",
      "target": "GIV1",
      "fixtureBytesHex": "47495631000102010012000000010000000000109192939495969798999a9b9c9d9e9fa000020000000000201112131415161718191a1b1c1d1e1f202122232425262728292a2b2c2d2e2f30000300000000002012131415161718191a1b1c1d1e1f202122232425262728292a2b2c2d2e2f3031000400000000000800000000000000000005000000000020131415161718191a1b1c1d1e1f202122232425262728292a2b2c2d2e2f30313200060000000000202122232425262728292a2b2c2d2e2f303132333435363738393a3b3c3d3e3f4000070000000000203132333435363738393a3b3c3d3e3f404142434445464748494a4b4c4d4e4f5000080000000000264450443100014142434445464748494a4b4c4d4e4f505152535455565758595a5b5c5d5e5f60000900000000002022232425262728292a2b2c2d2e2f303132333435363738393a3b3c3d3e3f4041000a00000000000103000b000000000026414443310002232425262728292a2b2c2d2e2f303132333435363738393a3b3c3d3e3f404142000c0000000000264144483100012425262728292a2b2c2d2e2f303132333435363738393a3b3c3d3e3f40414243000d00000000002025262728292a2b2c2d2e2f303132333435363738393a3b3c3d3e3f4041424344000e000000000020262728292a2b2c2d2e2f303132333435363738393a3b3c3d3e3f404142434445000f0000000000264452533100012728292a2b2c2d2e2f303132333435363738393a3b3c3d3e3f4041424344454600100000000000080000000000000064001100000000000800000000000000c800120000000000408d3c1966201694d99cdd50c6a99c08bf4aee99951ebbc232c8d8ceed7536a818dfabdac1809e501ba3bcf9239a14e72d84890729ee6118a8e4ce1fd8f4a78a0f",
      "recordHash32": "725464b5f1b30cfd6fe27c904c4d34128d33803630a2027a932c94e632aad5a3",
      "signerPublicKeyHex": "14c70c7e0c4c7712756ebbdfd33317be8fdf76358824e636098912ced81c1fb1"
    },
    {
      "id": "gia1-canonical",
      "target": "GIA1",
      "fixtureBytesHex": "4749413100010201000f000000010000000000109192939495969798999a9b9c9d9e9fa000020000000000201112131415161718191a1b1c1d1e1f202122232425262728292a2b2c2d2e2f30000300000000002012131415161718191a1b1c1d1e1f202122232425262728292a2b2c2d2e2f30310004000000000026474956310001725464b5f1b30cfd6fe27c904c4d34128d33803630a2027a932c94e632aad5a3000500000000002022232425262728292a2b2c2d2e2f303132333435363738393a3b3c3d3e3f4041000600000000002032333435363738393a3b3c3d3e3f404142434445464748494a4b4c4d4e4f5051000700000000002644504431000142434445464748494a4b4c4d4e4f505152535455565758595a5b5c5d5e5f60610008000000000026414443310002232425262728292a2b2c2d2e2f303132333435363738393a3b3c3d3e3f40414200090000000000264144483100012425262728292a2b2c2d2e2f303132333435363738393a3b3c3d3e3f40414243000a00000000002025262728292a2b2c2d2e2f303132333435363738393a3b3c3d3e3f4041424344000b000000000020262728292a2b2c2d2e2f303132333435363738393a3b3c3d3e3f404142434445000c0000000000264452533100012728292a2b2c2d2e2f303132333435363738393a3b3c3d3e3f40414243444546000d0000000000080000000000000078000e00000000000800000000000000be000f00000000004001b74cbb5b97cd997f7e0be6cc4a5160b5f1652e8c06b26f695e4c81c763f8ac6f6478aa3c58d65c297b19c08c291bf717f576352e3251397bd32201ea0a8c04",
      "recordHash32": "d959450a6fece4832cd6669ee611966994dc23d83b21bcf6ea447725d7aa05d3",
      "signerPublicKeyHex": "14c70c7e0c4c7712756ebbdfd33317be8fdf76358824e636098912ced81c1fb1"
    },
    {
      "id": "dgp1-canonical",
      "target": "DGP1",
      "fixtureBytesHex": "4447503100010201000d000000010000000000109192939495969798999a9b9c9d9e9fa000020000000000201112131415161718191a1b1c1d1e1f202122232425262728292a2b2c2d2e2f300003000000000008000000000000000000040000000000201415161718191a1b1c1d1e1f202122232425262728292a2b2c2d2e2f30313233000500000000002015161718191a1b1c1d1e1f202122232425262728292a2b2c2d2e2f303132333400060000000000202122232425262728292a2b2c2d2e2f303132333435363738393a3b3c3d3e3f4000070000000000203132333435363738393a3b3c3d3e3f404142434445464748494a4b4c4d4e4f5000080000000000264450443100014142434445464748494a4b4c4d4e4f505152535455565758595a5b5c5d5e5f6000090000000000020006000a000000000013000c766563746f722d67726f75700100000e10000b0000000000080000000000000064000c00000000000800000000000000c8000d00000000004089dd96358fdd214bc99a2da4503f850f2eb13f55ec2af74bb4319f0b60cdf45b1a592fa8888d09cebdfb391eda06289ea3139fa86e2937795c3de438f2f57f01",
      "recordHash32": "1c7219b66e2961fea908d69092c1957a3af2c97a814de1c18bffd18bc3935095",
      "signerPublicKeyHex": "14c70c7e0c4c7712756ebbdfd33317be8fdf76358824e636098912ced81c1fb1"
    },
    {
      "id": "dgc1-canonical",
      "target": "DGC1",
      "fixtureBytesHex": "44474331000102010011000000010000000000109192939495969798999a9b9c9d9e9fa000020000000000201112131415161718191a1b1c1d1e1f202122232425262728292a2b2c2d2e2f3000030000000000020001000400000000000800000000000000000005000000000020000000000000000000000000000000000000000000000000000000000000000000060000000000202122232425262728292a2b2c2d2e2f303132333435363738393a3b3c3d3e3f4000070000000000203132333435363738393a3b3c3d3e3f404142434445464748494a4b4c4d4e4f5000080000000000264450443100014142434445464748494a4b4c4d4e4f505152535455565758595a5b5c5d5e5f6000090000000000020000000a000000000000000b0000000000020001000c00000000012401222122232425262728292a2b2c2d2e2f303132333435363738393a3b3c3d3e3f40014144433100026162636465666768696a6b6c6d6e6f707172737475767778797a7b7c7d7e7f8041444831000162636465666768696a6b6c6d6e6f707172737475767778797a7b7c7d7e7f8081636465666768696a6b6c6d6e6f707172737475767778797a7b7c7d7e7f80818200000000000000016465666768696a6b6c6d6e6f707172737475767778797a7b7c7d7e7f8081828344525331000165666768696a6b6c6d6e6f707172737475767778797a7b7c7d7e7f8081828384013132333435363738393a3b3c3d3e3f404142434445464748494a4b4c4d4e4f504450443100014142434445464748494a4b4c4d4e4f505152535455565758595a5b5c5d5e5f60000d00000000000c766563746f722d67726f7570000e00000000000100000f00000000000400000e10001000000000000800000000000000780011000000000040209827e11683c4b8d7cce3f88c6247cbaccab6a5513d6691a373412ca88712380e7cb128511b5fe0285c3f7843a339c6f16636c6d0692c221c8730b302e5d803",
      "recordHash32": "dda394fcfc8c55a63a16913887c38acb12194be9d858ff9d80ca4c95aa223e4c",
      "signerPublicKeyHex": "14c70c7e0c4c7712756ebbdfd33317be8fdf76358824e636098912ced81c1fb1"
    },
    {
      "id": "dgt1-canonical",
      "target": "DGT1",
      "fixtureBytesHex": "4447543100010201000e000000010000000000109192939495969798999a9b9c9d9e9fa000020000000000201112131415161718191a1b1c1d1e1f202122232425262728292a2b2c2d2e2f300003000000000026444743310001dda394fcfc8c55a63a16913887c38acb12194be9d858ff9d80ca4c95aa223e4c0004000000000008000000000000000000050000000000203132333435363738393a3b3c3d3e3f404142434445464748494a4b4c4d4e4f500006000000000020333435363738393a3b3c3d3e3f404142434445464748494a4b4c4d4e4f5051520007000000000026445044310001434445464748494a4b4c4d4e4f505152535455565758595a5b5c5d5e5f60616200080000000000203435363738393a3b3c3d3e3f404142434445464748494a4b4c4d4e4f50515253000900000000002644525331000135363738393a3b3c3d3e3f404142434445464748494a4b4c4d4e4f5051525354000a000000000020363738393a3b3c3d3e3f404142434445464748494a4b4c4d4e4f505152535455000b0000000000080000000000000078000c00000000000800000000000000b4000d0000000000264450413100013738393a3b3c3d3e3f404142434445464748494a4b4c4d4e4f50515253545556000e0000000000406847fc9068b3bc1c4a65e9f647e7b23b92b32a728b05eac299f0877911893cadbaae20a325ae37084f26b367e5c153fdd5be4d9bc254a78b12faafc44e0db304",
      "recordHash32": "9abb7f980973372b676a3e44752e74b26f1f84f79f4ab39bc87e5a7797818901",
      "signerPublicKeyHex": "14c70c7e0c4c7712756ebbdfd33317be8fdf76358824e636098912ced81c1fb1"
    },
    {
      "id": "dgm1-canonical",
      "target": "DGM1",
      "fixtureBytesHex": "44474d3100010201000c000000010000000000109192939495969798999a9b9c9d9e9fa000020000000000201112131415161718191a1b1c1d1e1f202122232425262728292a2b2c2d2e2f30000300000000000800000000000000000004000000000020dda394fcfc8c55a63a16913887c38acb12194be9d858ff9d80ca4c95aa223e4c0005000000000020161718191a1b1c1d1e1f202122232425262728292a2b2c2d2e2f30313233343500060000000000202122232425262728292a2b2c2d2e2f303132333435363738393a3b3c3d3e3f4000070000000000203132333435363738393a3b3c3d3e3f404142434445464748494a4b4c4d4e4f50000800000000000800000000000000010009000000000008000000000001d4c0000a000000000008000000000002bf20000b0000000000020001000c00000000000568656c6c6f",
      "recordHash32": "5d0dfc7d7e0e092b48395ec793a7c724e719bfb26d106b648712d5a122f9c398",
      "signerPublicKeyHex": null
    },
    {
      "id": "gcp1-canonical",
      "target": "GCP1",